{"files":[{"normalization":"decoded_png_v1","path":"evidence/approved-previews/preview-001.png","rights":"user_owned_migration_approved","role":"approved-previews","sha256":"135957949541c0f404b35fff336e48fcbeab72db0ccfcb4191a7e231b65c8b66","size":918943,"source_sha256":"ebadd0cb51e412c27cfebb5ba673c3046c2bfc87d5b8091ae9e055678ed4c274"},{"normalization":"decoded_png_v1","path":"evidence/approved-previews/preview-002.png","rights":"user_owned_migration_approved","role":"approved-previews","sha256":"3d086cd2ce61e758ebaa1e6cfbb5a78733c0a9db275f0c927547d40987362f3f","size":666817,"source_sha256":"997bade2eb57ca6ee71cee6db48ba6bdf34bb7ab8fc896bbde888cc1c9e727d3"},{"normalization":"decoded_png_v1","path":"evidence/approved-previews/preview-003.png","rights":"user_owned_migration_approved","role":"approved-previews","sha256":"cafdc65a15adaccc6c16c70f574acacd5a271aa5828649d8bd1e166e97e12176","size":1175772,"source_sha256":"23024820e52c43484930b6ccf13c13cc7dd2635a61e42d478ee8e3b78a6cf5fc"},{"normalization":"decoded_png_v1","path":"evidence/approved-previews/preview-004.png","rights":"user_owned_migration_approved","role":"approved-previews","sha256":"859d2f5f24ffcd80e2fd41cfcdb1933354a6b97d15c909682b2c799b51b1c067","size":1222198,"source_sha256":"a3fc6df3743426776e3aad92859805f49c6c045ff2eb591b1d8193b590a3ee32"},{"normalization":"decoded_png_v1","path":"evidence/approved-previews/preview-005.png","rights":"user_owned_migration_approved","role":"approved-previews","sha256":"ce4da82256a288f5f836aef7e6f4281d20780fc77b3a81bb88964e3dbbb4ff52","size":1222495,"source_sha256":"8404e9ff05b60c16e9fd6413583b23d7da1b1718a7056aef3f547fe3b9dd58b0"},{"normalization":"decoded_png_v1","path":"evidence/approved-previews/preview-006.png","rights":"user_owned_migration_approved","role":"approved-previews","sha256":"ad8fe38f3dd63072961cae67db7248b79014a709d22b23d848fd0a313566512b","size":1175817,"source_sha256":"0bfd2d31e293f744bf08ac14865e520587a6a5cb5cd4c470ad3ead52cc1d3a48"},{"normalization":"decoded_png_v1","path":"evidence/approved-previews/preview-007.png","rights":"user_owned_migration_approved","role":"approved-previews","sha256":"56fba38ab3df5b313bccb42e2943455978885b796d5fb3e84aafbb9c27727eca","size":1222224,"source_sha256":"ef592787d726500b25fef4a809e8f8fd46dfdd356e886fc5cd6018c778f76cc6"},{"normalization":"decoded_png_v1","path":"evidence/approved-previews/preview-008.png","rights":"user_owned_migration_approved","role":"approved-previews","sha256":"472e8bb377df312f559399345f933e1d4b90bf2fb205a5c1e5d7c10ba9133e74","size":1222547,"source_sha256":"8d1bea29b6b8d73199ce00b9f73c9ee005be220cebffaebb41f8e695861e9e55"},{"normalization":"decoded_png_v1","path":"evidence/assets/hand-001.png","rights":"user_owned_migration_approved","role":"hand","sha256":"c1dbd0e1d0e3456b96545903751340ab31a190829617bc9975549626961241a9","size":33091,"source_sha256":"9070343a1598afbbf94ce19fe5b7993ad7daa54c0c588f579106dc27212ac5ae"},{"normalization":"decoded_png_v1","path":"evidence/scale-references/scale-reference-001.png","rights":"user_owned_migration_approved","role":"scale-references","sha256":"135957949541c0f404b35fff336e48fcbeab72db0ccfcb4191a7e231b65c8b66","size":918943,"source_sha256":"ebadd0cb51e412c27cfebb5ba673c3046c2bfc87d5b8091ae9e055678ed4c274"},{"normalization":"decoded_png_v1","path":"evidence/scale-references/scale-reference-002.png","rights":"user_owned_migration_approved","role":"scale-references","sha256":"3d086cd2ce61e758ebaa1e6cfbb5a78733c0a9db275f0c927547d40987362f3f","size":666817,"source_sha256":"997bade2eb57ca6ee71cee6db48ba6bdf34bb7ab8fc896bbde888cc1c9e727d3"},{"normalization":"generated_v1","path":"intake.json","rights":"user_owned_migration_approved","role":"registration","sha256":"ec48b0f8747d2a509c707f0e1dd149f4642098f42fb8b9e23ac09f1f23bfd772","size":2720,"source_sha256":"ec48b0f8747d2a509c707f0e1dd149f4642098f42fb8b9e23ac09f1f23bfd772"},{"normalization":"generated_v1","path":"RESTORE.md","rights":"user_owned_migration_approved","role":"restore_guide","sha256":"0aaf68066914ede1d476ff706d44153a6d68461b0a1b4247a6c52ae2cceb8ab6","size":1352,"source_sha256":"0aaf68066914ede1d476ff706d44153a6d68461b0a1b4247a6c52ae2cceb8ab6"}],"manifest_sha256":"d8fa97756c51e70df9c2ef2c59985eee2dd9b43ec560255f392a7a0a57819b80","profile_key":"senior-high-history","release_version":"1.7.0","schema_version":1,"source_commit":"9ffdfabecb66121a16dbeab4dcb7f3d8aee4ecc1","stage_id":"senior-high","subject_id":"history","target_requires_explicit_binding":true}
